{
  "analytics": {
    "enabled": true,
    "providers": [
      {
        "name": "google_analytics",
        "enabled": true,
        "trackingId": "G-XXXXXXXXXX"
      }
    ]
  },
  "shipping": [
    {
      "provider": "tcs",
      "enabled": true,
      "default": true,
      "credentialsRef": "secrets/tcs"
    }
  ],
  "webhooks": [
    {
      "id": "c3d4e5f6-a7b8-9012-cdef-123456789012",
      "url": "https://erp.example.com/webhooks/orders",
      "events": ["order.created", "order.fulfilled"],
      "enabled": true,
      "secretRef": "secrets/webhook-erp"
    }
  ],
  "plugins": []
}
